[
  {
    "state": "Lagos",
    "state_code": "LA",
    "index_value": 1.35,
    "band_budget": { "min_naira": 2500, "max_naira": 6000 },
    "band_mid_range": { "min_naira": 8000, "max_naira": 20000 },
    "band_premium": { "min_naira": 25000, "max_naira": 80000 },
    "last_verified": "2026-09-15",
    "source_ref": "WFP-NGA-2026-09,NBS-CPI-2026-09",
    "notes": "Highest cost state; Victoria Island/Lekki premium band 40% above mainland"
  },
  {
    "state": "Abuja",
    "state_code": "FC",
    "index_value": 1.28,
    "band_budget": { "min_naira": 2200, "max_naira": 5500 },
    "band_mid_range": { "min_naira": 7500, "max_naira": 18000 },
    "band_premium": { "min_naira": 22000, "max_naira": 70000 },
    "last_verified": "2026-09-15",
    "source_ref": "WFP-NGA-2026-09,NBS-CPI-2026-09",
    "notes": "Diplomatic/government premium drives Maitama/Asokoro prices"
  },
  {
    "state": "Port Harcourt",
    "state_code": "RV",
    "index_value": 1.22,
    "band_budget": { "min_naira": 2000, "max_naira": 5000 },
    "band_mid_range": { "min_naira": 7000, "max_naira": 17000 },
    "band_premium": { "min_naira": 20000, "max_naira": 60000 },
    "last_verified": "2026-09-15",
    "source_ref": "WFP-NGA-2026-09,NBS-CPI-2026-09",
    "notes": "Oil-sector income inflates GRA/Trans Amadi; seafood premium"
  },
  {
    "state": "Kano",
    "state_code": "KN",
    "index_value": 0.88,
    "band_budget": { "min_naira": 1000, "max_naira": 3000 },
    "band_mid_range": { "min_naira": 4000, "max_naira": 12000 },
    "band_premium": { "min_naira": 15000, "max_naira": 45000 },
    "last_verified": "2026-09-15",
    "source_ref": "WFP-NGA-2026-09,NBS-CPI-2026-09",
    "notes": "Lowest cost major city; halal-only supply chain reduces variety premium"
  },
  {
    "state": "Ibadan",
    "state_code": "OY",
    "index_value": 0.92,
    "band_budget": { "min_naira": 1200, "max_naira": 3500 },
    "band_mid_range": { "min_naira": 4500, "max_naira": 13000 },
    "band_premium": { "min_naira": 15000, "max_naira": 45000 },
    "last_verified": "2026-09-15",
    "source_ref": "WFP-NGA-2026-09,NBS-CPI-2026-09",
    "notes": "UI student population anchors budget band; amala economy keeps prices low"
  },
  {
    "state": "Enugu",
    "state_code": "EN",
    "index_value": 0.98,
    "band_budget": { "min_naira": 1500, "max_naira": 4000 },
    "band_mid_range": { "min_naira": 5000, "max_naira": 14000 },
    "band_premium": { "min_naira": 18000, "max_naira": 50000 },
    "last_verified": "2026-09-15",
    "source_ref": "WFP-NGA-2026-09,NBS-CPI-2026-09",
    "notes": "Coal city mid-range; university towns (UNN, ESUT) support budget tier"
  },
  {
    "state": "Calabar",
    "state_code": "CR",
    "index_value": 1.05,
    "band_budget": { "min_naira": 1800, "max_naira": 4500 },
    "band_mid_range": { "min_naira": 6000, "max_naira": 15000 },
    "band_premium": { "min_naira": 18000, "max_naira": 55000 },
    "last_verified": "2026-09-15",
    "source_ref": "WFP-NGA-2026-09,NBS-CPI-2026-09",
    "notes": "Tourism + cross-border trade; Tinapa resort drives premium"
  },
  {
    "state": "Benin City",
    "state_code": "ED",
    "index_value": 0.95,
    "band_budget": { "min_naira": 1400, "max_naira": 3800 },
    "band_mid_range": { "min_naira": 4800, "max_naira": 13500 },
    "band_premium": { "min_naira": 16000, "max_naira": 48000 },
    "last_verified": "2026-09-15",
    "source_ref": "WFP-NGA-2026-09,NBS-CPI-2026-09",
    "notes": "Edo state capital; UNIBEN student demand supports budget"
  },
  {
    "state": "Warri",
    "state_code": "DT",
    "index_value": 1.15,
    "band_budget": { "min_naira": 2000, "max_naira": 5000 },
    "band_mid_range": { "min_naira": 6500, "max_naira": 16000 },
    "band_premium": { "min_naira": 18000, "max_naira": 55000 },
    "last_verified": "2026-09-15",
    "source_ref": "WFP-NGA-2026-09,NBS-CPI-2026-09",
    "notes": "Delta oil hub; Effurun/Sapele corridor premium"
  },
  {
    "state": "Owerri",
    "state_code": "IM",
    "index_value": 1.02,
    "band_budget": { "min_naira": 1600, "max_naira": 4200 },
    "band_mid_range": { "min_naira": 5500, "max_naira": 14500 },
    "band_premium": { "min_naira": 17000, "max_naira": 50000 },
    "last_verified": "2026-09-15",
    "source_ref": "WFP-NGA-2026-09,NBS-CPI-2026-09",
    "notes": "Entertainment capital; nightlife drives mid-range"
  },
  {
    "state": "Aba",
    "state_code": "AB",
    "index_value": 0.97,
    "band_budget": { "min_naira": 1500, "max_naira": 4000 },
    "band_mid_range": { "min_naira": 5000, "max_naira": 14000 },
    "band_premium": { "min_naira": 16000, "max_naira": 48000 },
    "last_verified": "2026-09-15",
    "source_ref": "WFP-NGA-2026-09,NBS-CPI-2026-09",
    "notes": "Commercial hub; Ariaria market keeps wholesale prices low"
  },
  {
    "state": "Jos",
    "state_code": "PL",
    "index_value": 0.93,
    "band_budget": { "min_naira": 1300, "max_naira": 3600 },
    "band_mid_range": { "min_naira": 4500, "max_naira": 13000 },
    "band_premium": { "min_naira": 15000, "max_naira": 45000 },
    "last_verified": "2026-09-15",
    "source_ref": "WFP-NGA-2026-09,NBS-CPI-2026-09",
    "notes": "Plateau agriculture; temperate produce lowers veg costs"
  },
  {
    "state": "Kaduna",
    "state_code": "KD",
    "index_value": 0.91,
    "band_budget": { "min_naira": 1200, "max_naira": 3500 },
    "band_mid_range": { "min_naira": 4200, "max_naira": 12500 },
    "band_premium": { "min_naira": 14000, "max_naira": 42000 },
    "last_verified": "2026-09-15",
    "source_ref": "WFP-NGA-2026-09,NBS-CPI-2026-09",
    "notes": "Northern rail hub; grain market proximity lowers staples"
  },
  {
    "state": "Maiduguri",
    "state_code": "BO",
    "index_value": 1.08,
    "band_budget": { "min_naira": 1800, "max_naira": 4500 },
    "band_mid_range": { "min_naira": 5500, "max_naira": 15000 },
    "band_premium": { "min_naira": 18000, "max_naira": 50000 },
    "last_verified": "2026-09-15",
    "source_ref": "WFP-NGA-2026-09,NBS-CPI-2026-09",
    "notes": "Conflict-affected supply routes; IDP population pressure"
  },
  {
    "state": "Sokoto",
    "state_code": "SO",
    "index_value": 0.85,
    "band_budget": { "min_naira": 900, "max_naira": 2800 },
    "band_mid_range": { "min_naira": 3800, "max_naira": 11000 },
    "band_premium": { "min_naira": 12000, "max_naira": 38000 },
    "last_verified": "2026-09-15",
    "source_ref": "WFP-NGA-2026-09,NBS-CPI-2026-09",
    "notes": "Lowest index; caliphate seat; millet/sorghum staple economy"
  },
  {
    "state": "Yenagoa",
    "state_code": "BY",
    "index_value": 1.18,
    "band_budget": { "min_naira": 2200, "max_naira": 5500 },
    "band_mid_range": { "min_naira": 7000, "max_naira": 17000 },
    "band_premium": { "min_naira": 20000, "max_naira": 60000 },
    "last_verified": "2026-09-15",
    "source_ref": "WFP-NGA-2026-09,NBS-CPI-2026-09",
    "notes": "Bayelsa capital; water-logged logistics inflate all costs"
  },
  {
    "state": "Asaba",
    "state_code": "DT",
    "index_value": 1.10,
    "band_budget": { "min_naira": 1900, "max_naira": 4800 },
    "band_mid_range": { "min_naira": 6000, "max_naira": 15500 },
    "band_premium": { "min_naira": 18000, "max_naira": 55000 },
    "last_verified": "2026-09-15",
    "source_ref": "WFP-NGA-2026-09,NBS-CPI-2026-09",
    "notes": "Delta capital; film industry + civil service demand"
  },
  {
    "state": "Uyo",
    "state_code": "AK",
    "index_value": 1.03,
    "band_budget": { "min_naira": 1700, "max_naira": 4300 },
    "band_mid_range": { "min_naira": 5500, "max_naira": 14500 },
    "band_premium": { "min_naira": 17000, "max_naira": 52000 },
    "last_verified": "2026-09-15",
    "source_ref": "WFP-NGA-2026-09,NBS-CPI-2026-09",
    "notes": "Akwa Ibom capital; oil derivation funds infrastructure"
  },
  {
    "state": "Adikpo",
    "state_code": "BE",
    "index_value": 0.96,
    "band_budget": { "min_naira": 1400, "max_naira": 3800 },
    "band_mid_range": { "min_naira": 4800, "max_naira": 13500 },
    "band_premium": { "min_naira": 15000, "max_naira": 45000 },
    "last_verified": "2026-09-15",
    "source_ref": "WFP-NGA-2026-09,NBS-CPI-2026-09",
    "notes": "Benue food basket; yam/rice surplus keeps staples cheap"
  },
  {
    "state": "Makurdi",
    "state_code": "BE",
    "index_value": 0.94,
    "band_budget": { "min_naira": 1300, "max_naira": 3600 },
    "band_mid_range": { "min_naira": 4500, "max_naira": 13000 },
    "band_premium": { "min_naira": 14000, "max_naira": 42000 },
    "last_verified": "2026-09-15",
    "source_ref": "WFP-NGA-2026-09,NBS-CPI-2026-09",
    "notes": "Benue capital; agricultural wholesale market"
  },
  {
    "state": "Lafia",
    "state_code": "NA",
    "index_value": 0.97,
    "band_budget": { "min_naira": 1400, "max_naira": 3900 },
    "band_mid_range": { "min_naira": 5000, "max_naira": 14000 },
    "band_premium": { "min_naira": 16000, "max_naira": 48000 },
    "last_verified": "2026-09-15",
    "source_ref": "WFP-NGA-2026-09,NBS-CPI-2026-09",
    "notes": "Nasarawa capital; Abuja spillover demand emerging"
  },
  {
    "state": "Minna",
    "state_code": "NI",
    "index_value": 0.99,
    "band_budget": { "min_naira": 1500, "max_naira": 4000 },
    "band_mid_range": { "min_naira": 5000, "max_naira": 14000 },
    "band_premium": { "min_naira": 16000, "max_naira": 48000 },
    "last_verified": "2026-09-15",
    "source_ref": "WFP-NGA-2026-09,NBS-CPI-2026-09",
    "notes": "Niger capital; hydro power + agriculture base"
  },
  {
    "state": "Ilorin",
    "state_code": "KW",
    "index_value": 0.93,
    "band_budget": { "min_naira": 1300, "max_naira": 3600 },
    "band_mid_range": { "min_naira": 4500, "max_naira": 13000 },
    "band_premium": { "min_naira": 15000, "max_naira": 45000 },
    "last_verified": "2026-09-15",
    "source_ref": "WFP-NGA-2026-09,NBS-CPI-2026-09",
    "notes": "Kwara capital; UNILORIN student population anchors budget"
  },
  {
    "state": "Abeokuta",
    "state_code": "OG",